{
  "id": "demo.process-binary-extension-template",
  "version": "1.0.0",
  "protocolVersion": "1",
  "artifact": {
    "kind": "binary",
    "entry": {
      "win32-x64": "./bin/plugin.exe",
      "linux-x64": "./bin/plugin-linux-x64",
      "darwin-arm64": "./bin/plugin-darwin-arm64",
      "default": "./bin/plugin"
    },
    "launch": {
      "args": [],
      "timeoutMs": 5000
    }
  },
  "runtime": "process",
  "capabilities": [
    {
      "name": "demo.hello"
    }
  ]
}
